[
  {
    "relation_id": "REL-FOUND-0001",
    "quelle": "CON:MAT:algebra",
    "relation": "requires",
    "ziel": "CON:MAT:vektoren",
    "status": "[R]",
    "kommentar": "Algebraische Grundlagen werden für Vektorrechnung benötigt.",
    "erstellt": "2026-06-24",
    "kurator": "T.P.K."
  },
  {
    "relation_id": "REL-FOUND-0002",
    "quelle": "CON:MAT:vektoren",
    "relation": "requires",
    "ziel": "CON:PHY:orbitalmechanik",
    "status": "[R]",
    "kommentar": "Orbitalmechanik verwendet Vektoren für Position, Geschwindigkeit, Kraft und Impuls.",
    "erstellt": "2026-06-24",
    "kurator": "T.P.K."
  },
  {
    "relation_id": "REL-FOUND-0003",
    "quelle": "CON:PHY:gravitation",
    "relation": "explains",
    "ziel": "CON:PHY:orbitalmechanik",
    "status": "[R]",
    "kommentar": "Orbitalmechanik ist Anwendung gravitativer Dynamik.",
    "erstellt": "2026-06-24",
    "kurator": "T.P.K."
  },
  {
    "relation_id": "REL-FOUND-0004",
    "quelle": "CON:CHE:wasser",
    "relation": "part_of",
    "ziel": "CON:GEO:hydrologie",
    "status": "[R]",
    "kommentar": "Hydrologie beschreibt den Wasserhaushalt.",
    "erstellt": "2026-06-24",
    "kurator": "T.P.K."
  },
  {
    "relation_id": "REL-FOUND-0005",
    "quelle": "CON:CHE:wasser",
    "relation": "requires",
    "ziel": "CON:BIO:leben",
    "status": "[R]",
    "kommentar": "Bekanntes irdisches Leben setzt Wasser als Lösungsmittel voraus.",
    "erstellt": "2026-06-24",
    "kurator": "T.P.K."
  },
  {
    "relation_id": "REL-FOUND-0006",
    "quelle": "CON:BIO:evolution",
    "relation": "explains",
    "ziel": "CON:BIO:leben",
    "status": "[R]",
    "kommentar": "Evolution erklärt langfristige Veränderung und Anpassung lebender Systeme.",
    "erstellt": "2026-06-24",
    "kurator": "T.P.K."
  },
  {
    "relation_id": "REL-FOUND-0007",
    "quelle": "CON:AST:habitable-zone",
    "relation": "requires",
    "ziel": "CON:CHE:wasser",
    "status": "[R]",
    "kommentar": "Die klassische Habitable-Zone-Definition bezieht sich auf flüssiges Wasser.",
    "erstellt": "2026-06-24",
    "kurator": "T.P.K."
  },
  {
    "relation_id": "REL-FOUND-0008",
    "quelle": "CON:GEO:atmosphaere",
    "relation": "part_of",
    "ziel": "CON:GEO:klima",
    "status": "[R]",
    "kommentar": "Klima beschreibt langfristige atmosphärische und gekoppelte Prozesse.",
    "erstellt": "2026-06-24",
    "kurator": "T.P.K."
  },
  {
    "relation_id": "REL-FOUND-0009",
    "quelle": "CON:PHY:energie",
    "relation": "part_of",
    "ziel": "CON:CHE:redoxreaktion",
    "status": "[R]",
    "kommentar": "Redoxreaktionen sind zentrale Energieumwandlungsprozesse in Chemie und Biologie.",
    "erstellt": "2026-06-24",
    "kurator": "T.P.K."
  },
  {
    "relation_id": "REL-FOUND-0010",
    "quelle": "CON:PHY:strahlung",
    "relation": "influences",
    "ziel": "CON:BIO:leben",
    "status": "[R]",
    "kommentar": "Strahlung kann Energiequelle, Beobachtungssignal oder biologischer Risikofaktor sein. Beziehungstyp influences ist Kandidat für ARC-0006-Erweiterung.",
    "erstellt": "2026-06-24",
    "kurator": "T.P.K."
  },
  {
    "relation_id": "REL-KON-0001",
    "quelle": "CON:L1:zeitform",
    "relation": "part_of",
    "ziel": "MOD:L2:contracomology-core",
    "status": "[W]",
    "kommentar": "Grundeinheit im Kernmodell.",
    "erstellt": "2026-07-03",
    "kurator": "T.P.K."
  },
  {
    "relation_id": "REL-KON-0002",
    "quelle": "CON:L1:avi-punkt",
    "relation": "part_of",
    "ziel": "CON:L1:oem",
    "status": "[W]",
    "kommentar": "Der AVI-Punkt ist der Übergang, den ein OEM durchläuft.",
    "erstellt": "2026-07-03",
    "kurator": "T.P.K."
  },
  {
    "relation_id": "REL-KON-0003",
    "quelle": "CON:L1:oem",
    "relation": "part_of",
    "ziel": "MOD:L2:contracomology-core",
    "status": "[W]",
    "kommentar": "",
    "erstellt": "2026-07-03",
    "kurator": "T.P.K."
  },
  {
    "relation_id": "REL-KON-0004",
    "quelle": "CON:L1:ma-u",
    "relation": "part_of",
    "ziel": "MOD:L2:contracomology-core",
    "status": "[W]",
    "kommentar": "Gleichrangig mit Ma'Ta'U.",
    "erstellt": "2026-07-03",
    "kurator": "T.P.K."
  },
  {
    "relation_id": "REL-KON-0005",
    "quelle": "CON:L1:ma-ta-u",
    "relation": "part_of",
    "ziel": "MOD:L2:contracomology-core",
    "status": "[W]",
    "kommentar": "Gleichrangig mit Ma'U.",
    "erstellt": "2026-07-03",
    "kurator": "T.P.K."
  },
  {
    "relation_id": "REL-KON-0006",
    "quelle": "MOD:L2:paradigmentriade",
    "relation": "part_of",
    "ziel": "MOD:L2:contracomology-core",
    "status": "[W]",
    "kommentar": "Sammelknoten der Paradigmen.",
    "erstellt": "2026-07-03",
    "kurator": "T.P.K."
  },
  {
    "relation_id": "REL-KON-0007",
    "quelle": "MOD:L2:paradigma-bach",
    "relation": "part_of",
    "ziel": "MOD:L2:paradigmentriade",
    "status": "[W]",
    "kommentar": "",
    "erstellt": "2026-07-03",
    "kurator": "T.P.K."
  },
  {
    "relation_id": "REL-KON-0008",
    "quelle": "MOD:L2:paradigma-chopin",
    "relation": "part_of",
    "ziel": "MOD:L2:paradigmentriade",
    "status": "[W]",
    "kommentar": "",
    "erstellt": "2026-07-03",
    "kurator": "T.P.K."
  },
  {
    "relation_id": "REL-KON-0009",
    "quelle": "MOD:L2:paradigma-wagner",
    "relation": "part_of",
    "ziel": "MOD:L2:paradigmentriade",
    "status": "[W]",
    "kommentar": "",
    "erstellt": "2026-07-03",
    "kurator": "T.P.K."
  },
  {
    "relation_id": "REL-KON-0010",
    "quelle": "CON:L1:avi-transformation",
    "relation": "part_of",
    "ziel": "CON:L1:oem",
    "status": "[W]",
    "kommentar": "Der vollständige Bogen, den ein OEM durchläuft.",
    "erstellt": "2026-07-15",
    "kurator": "T.P.K."
  },
  {
    "relation_id": "REL-KON-0011",
    "quelle": "CON:L1:phasenuebergang",
    "relation": "part_of",
    "ziel": "CON:L1:avi-transformation",
    "status": "[W]",
    "kommentar": "Der Umschlag innerhalb des AVI-Bogens.",
    "erstellt": "2026-07-15",
    "kurator": "T.P.K."
  }
]
